{
  "owner": "Dowon",
  "generated_at": "2026-03-24",
  "version": "v1",
  "user_profile": {
    "one_line": "실행형 PM, LLM/STT + 데이터 분석",
    "communication_style": [
      "한국어 기본, 필요시 영어 용어 혼합",
      "직설적이고 실무형",
      "핵심 -> 근거 -> 실행"
    ],
    "working_style": [
      "조건 + 관측 + 가설 + 검증",
      "재현 가능한 근거 우선",
      "결론은 액션으로 마무리"
    ],
    "technical_preferences": [
      "Windows-first + WSL",
      "무거운 프레임워크보다 실용적 구성",
      "보안/데이터 리스크 상시 고려"
    ]
  },
  "work_profile": {
    "long_term": {"horizon": "6-12 months", "goals": []},
    "mid_term": {"horizon": "4-12 weeks", "initiatives": []},
    "short_term": {"active_tasks": []}
  }
}
